<?xml version='1.0' encoding='utf-8'?>
<function id="getDescription" xmlns="http://bsi.bund.de/TR03151" xmlns:xsi="http://www.w3.org/2001/XMLSchema-instance" xsi:schemaLocation="http://bsi.bund.de/TR03151 ../../schema/functions.xsd">
  <name>getDescription</name>
  <category>Geräteinitialisierung</category>
  <description>The function getDescription can be used to obtain the short description of the device that is set using the function setDescription and also provided in the in the device information file.</description>
  <detailedSteps>
    <step>
      <number>1</number>
      <originalText>If the referencing guideline limits the access to the functionality solely to authenticated users, the function SHALL check if the user that has invoked the function has the status authenticated. If the status is not authenticated, the function SHALL raise the exception ErrorUserNotAuthenticated and exit the function.</originalText>
      <germanText>Prüft, ob Nutzer authentifiziert. Falls nicht: Exception ErrorUserNotAuthenticated, Ende.</germanText>
      <pseudocode>WENN Benutzer NICHT authentifiziert DANN
  WERFE ErrorUserNotAuthenticated
  BEENDE_FUNKTION
ENDE</pseudocode>
      <errorCase>
        <exception>ErrorUserNotAuthenticated</exception>
        <trigger>Der Benutzer ist nicht authentifiziert</trigger>
        <action>Funktion beenden</action>
      </errorCase>
    </step>
    <step>
      <number>2</number>
      <originalText>If the referencing guideline limits the access to the functionality to certain roles, the function SHALL check in the corresponding role if the (unauthenticated) user is authorized to execute the function. If the user is not authorized, the function SHALL raise the exception ErrorUserNotAuthorized and exit the function.</originalText>
      <germanText>Prüft, ob Nutzer berechtigt. Falls nicht: Exception ErrorUserNotAuthorized, Ende.</germanText>
      <pseudocode>WENN Benutzer NICHT autorisiert DANN
  WERFE ErrorUserNotAuthorized
  BEENDE_FUNKTION
ENDE</pseudocode>
      <errorCase>
        <exception>ErrorUserNotAuthorized</exception>
        <trigger>Der Benutzer ist nicht berechtigt</trigger>
        <action>Funktion beenden</action>
      </errorCase>
    </step>
    <step>
      <number>3</number>
      <originalText>The function SHALL determine information needed to populate the variable $6 as defined in chapter 2.5.3. A not set description SHALL be represented by an empty string. If the determination of the description fails, the function SHALL raise the exception ErrorGetDescriptionFailed and exit the function.</originalText>
      <germanText>Ermittelt Beschreibung. Bei Fehler: Exception ErrorGetDescriptionFailed, Ende.</germanText>
      <pseudocode>VERSUCHE
  ERMITTLE Beschreibungsinformation
BEI_FEHLER
  WERFE ErrorGetDescriptionFailed
  BEENDE_FUNKTION
ENDE</pseudocode>
      <errorCase>
        <exception>ErrorGetDescriptionFailed</exception>
        <trigger>Die Ermittlung der Beschreibung schlägt fehl</trigger>
        <action>Funktion beenden</action>
      </errorCase>
    </step>
    <step>
      <number>4</number>
      <originalText>If the determination of all information needed to populate the variable $6 as defined in chapter 2.5.3 is successful, the function SHALL return this information using the output parameter description. Additionally, the function SHALL return without raising an exception to indicate that the execution of the function has been successful.</originalText>
      <germanText>Gibt Beschreibung zurück. Bei Erfolg keine Exception.</germanText>
      <pseudocode>GEBE Beschreibung zurück (description Parameter)
RETURN ohne Exception</pseudocode>
      <successCase>
        <condition>Ausführung war erfolgreich</condition>
        <action>Funktion kehrt ohne Exception zurück</action>
      </successCase>
    </step>
  </detailedSteps>
  <parameters />
  <returnValue>
    <type>String</type>
    <description>a short description of the device.</description>
  </returnValue>
  <exceptions>
    <exception>ErrorDeviceNotInitialized</exception>
    <exception>ErrorFunctionFailed</exception>
    <exception>ErrorFunctionNotSupported</exception>
    <exception>ErrorGetDescriptionFailed</exception>
    <exception>ErrorParameterSyntax</exception>
    <exception>ErrorStorageMediumDisconnected</exception>
    <exception>ErrorUserNotAuthenticated</exception>
    <exception>ErrorUserNotAuthorized</exception>
  </exceptions>
</function>
